{
  "schedule_id": "2027-03-21-youths",
  "date": "2027-03-21",
  "segment": "Youths",
  "entry_type": "lesson",
  "status": "draft",
  "notes": "Placeholder pilot schedule aligned to Wellington school terms. Replace via Decap once the church calendar is approved (ADR-011).",
  "lesson_id": "Y1-L21"
}
