{
  "schedule_id": "2026-11-29-teens",
  "date": "2026-11-29",
  "segment": "Teens",
  "entry_type": "lesson",
  "status": "draft",
  "notes": "Placeholder pilot schedule aligned to Wellington school terms. Replace via Decap once the church calendar is approved (ADR-011).",
  "lesson_id": "T1-L11"
}
