{
  "schedule_id": "2026-08-30-teens",
  "date": "2026-08-30",
  "segment": "Teens",
  "entry_type": "break",
  "status": "draft",
  "notes": "Placeholder schedule for the pilot. Replace via Decap CMS once the church calendar is approved (ADR-011).",
  "message": "No Sunday School this week for the school holidays. We meet again next Sunday."
}
